#,Title,Summary,Price,Proposal Questions,Job URL,Client Location
66,AI Agents Specialist,"Looking for an experienced AI/automation specialist to build and manage intelligent agents that can streamline workflows. Key focus: AI agents that can parse and analyze incoming emails, extract and structure relevant data automatically, identify key information, and automate repetitive decision-making tasks.",Not listed,,https://www.upwork.com/jobs/~022049501162654343125,United States
67,Deterministic AI Agent Development,"Seeking a skilled developer to create a deterministic AI agent that strictly adheres to a provided Knowledge Base (KB). The agent must respond based solely on the information contained within the KB, avoiding assumption, extrapolation, or invention of data.","Fixed: $2,000.00",Describe your recent experience with similar projects,https://www.upwork.com/jobs/~022036360693979639051,United Arab Emirates
68,Ai Automation Agent,"Building an AI agent to integrate with Outlook and process invoices and purchase orders, check stocks in accounting software, and send invoices in Outlook for review and sending.",Hourly: $25.00-$50.00,,https://www.upwork.com/jobs/~022047499561815187413,Australia
69,AI Agents,Working with clients to build AI agents of all types and complexity. U.S. located freelancers only.,Hourly: $25.00-$100.00,,https://www.upwork.com/jobs/~022046997348112005722,United States
70,Enterprise AI Automation Specialist,"Looking for an Enterprise AI Automation Specialist to analyze and optimize existing operational workflows using AI and automation. Role involves auditing workflows, identifying inefficiencies, designing automated systems, building AI-driven workflows using custom agents, integrations, and automation pipelines.",Hourly: $30.00-$60.00,,https://www.upwork.com/jobs/~022052527207467118206,Canada
71,Full Stack + AI Systems Engineer (AI Operating System for Businesses),"Building an AI-powered operating system that audits, diagnoses, and improves businesses automatically. System functions as an AI consultant and execution engine: user inputs website, system audits tech stack/marketing/funnel, AI agents execute solutions automatically. Featured job.",Hourly: $15.00-$35.00,,https://www.upwork.com/jobs/~022047384607455262873,United States
72,AI Voice Agent Automation,"Need a freelancer to build and set up an AI voice agent for outbound prospecting. System should call leads, speak naturally, answer general questions, identify interested prospects, and automatically push interested leads with notes into a Google Sheet.",Fixed: $50.00,,https://www.upwork.com/jobs/~022044792176983564366,United Kingdom
73,Creating AI agent and System,Education and migration consultancy wants to implement AI Agent and automation to make workflow simple.,Not listed,,https://www.upwork.com/jobs/~022053445036363921375,Australia
74,"AI Voice Agent Developer – Build AI Caller with Warm Transfer, Data Capture, and Webhooks","Looking for an experienced AI Voice Agent developer to build an advanced AI calling system that can handle outbound calls, qualify leads, collect data, and perform a warm transfer to a closing agent when a prospect shows interest. First project in a larger AI calling infrastructure. Featured job.",Not listed,,https://www.upwork.com/jobs/~022042345940180583224,United States
75,AI automation Specialist Wanted For E-comm,"Looking for an experienced AI Automation Specialist to design, build, and deploy an intelligent customer service agent handling inbound customer inquiries in real time across Facebook Messenger, Instagram DMs, and email. Successful delivery will lead to additional AI agent builds.",Hourly: $15.00-$30.00,Can you share examples of similar projects you've worked on?,https://www.upwork.com/jobs/~022026600056888795518,USA
76,AI Voice Agent Development for Inbound Calls,"Seeking an experienced developer to create a sophisticated AI voice agent designed specifically for handling inbound calls. The ideal candidate should have expertise in natural language processing, machine learning, and voice recognition technologies.",Hourly: $5.00-$20.00,Describe your recent experience with similar projects | How do you use metrics to inform your strategy?,https://www.upwork.com/jobs/~022043958267832741646,United Arab Emirates
77,Build Real Estate Agentic AI,"Licensed Realtor in Greater Boston area looking to build a custom automated lead generation and outreach system using n8n. System should monitor data sources, enrich lead data via API, generate personalized outreach using Claude or GPT, deliver via Gmail, log automatically, trigger real-time Slack notifications, track leads in HubSpot CRM. U.S. freelancers only.",Fixed: $500.00,,https://www.upwork.com/jobs/~022046705886476162614,United States
78,AI Agent System for Social Media,"Seeking a skilled freelancer to develop an AI agent system capable of generating and scheduling content on TikTok, Instagram, and Facebook. Requires experience in AI development and social media management.","Fixed: $5,000.00",Describe your recent experience with similar projects,https://www.upwork.com/jobs/~022048559884192936556,United States
79,AI Agent Developer (Automation & Workflow Integration),"Looking for a developer to build a simple AI agent that can monitor calendar events, send email notifications, and log meeting details into monday.com. Goal is to automate scheduling workflows, improve visibility of upcoming meetings, and reduce manual work. U.S. only.",Fixed: $50.00,,https://www.upwork.com/jobs/~022041673732134977268,USA
80,AI Expert for Complex Voice Agent,"Looking for an experienced Retell AI developer to build or optimize a sophisticated voice agent that handles complex conversational scenarios with multi-step conversation flows, branching logic, conditional logic, context-aware responses, and backend system integrations. Featured job.",Hourly: $30.00-$60.00,Provide a phone number or a demo for your voice AI Agent,https://www.upwork.com/jobs/~022047785563460935637,United States
81,AI Agent Developer for WooCommerce,"Looking for an experienced developer to build and integrate an AI-powered assistant into a WooCommerce webshop. The AI agent should understand natural language product requests, ask clarifying questions, and recommend relevant products from the existing product database based on budget, season, sustainability, etc.",Hourly: $12.00-$27.00,,https://www.upwork.com/jobs/~022048835617009377237,Switzerland
82,Ai agents and automations,AI agency in the UK helping businesses implement AI. Looking for a freelancer who is an expert in creating tailored AI agents and automations and is reliable.,Not listed,,https://www.upwork.com/jobs/~022051318589073928401,GBR
83,"Senior AI Engineer | Coding Agents, AI Generated Slides, Python-pptx knowledge","Product company building a production-grade multi-agent system powered by RAG and LangGraph. One key agent will generate PowerPoint presentations from natural language by writing code that produces a PPTX file. Requires coding agent experience, think-cell chart automation, and LangGraph integration.",Hourly: $20.00-$60.00,,https://www.upwork.com/jobs/~022051945297187567724,ARE
84,Expert AI Developer Needed,"Need a skilled developer to build an AI-powered Marketing Assistant. Core tasks include appointment setting & lead qualification, copywriting (emails, ads, social content), automated follow-up sequences, and lead research and CRM updates. U.S. freelancers only.",Hourly: $30.00-$50.00,,https://www.upwork.com/jobs/~022047117704171681543,United States
85,AI Voice Agents,"Implement conversational agents in client environments for managing notifications, incidents, budget requests, or inquiries. Integration with internal systems using tools such as Retell AI, SIP, Twilio, VPS, n8n, and databases.",Not listed,,https://www.upwork.com/jobs/~022048645472010238554,Spain
86,Agentic AI + Sales,"Looking for someone to help build an AI-powered sales/outreach pipeline for a SaaS startup. Includes evaluating ICPs, finding target companies/contacts, determining best outreach channel, recommending outreach messages, monitoring replies, and determining follow-up timing. Looking for agentic workflow design, not simple Zapier setup.",Hourly: $3.00-$6.00,,https://www.upwork.com/jobs/~022048503118017032812,United States
87,AI Agent for Chatbot Development,Seeking an AI agent developer as a partner for different ideas to implement. Looking for long-term relationship.,Not listed,,https://www.upwork.com/jobs/~022047987766378166023,Oman
88,Claude Code AI Specialist - Agent Developer,"Looking for an experienced Claude Code AI Specialist to develop intelligent automation agents and AI-powered solutions. Must have experience with AI/ML, Python, and building production-ready AI systems.",Hourly: $30.00,,https://www.upwork.com/jobs/~022052760603172452319,United States
89,AI Sales Agent Prompt Engineer,Looking for an LLM prompt engineer to enhance a sales agent prompt for maximum effectiveness and efficient use of tokens. The prompt is done but needs enhancements and debloating using modern techniques. Chosen LLM is Claude Sonnet 4.6.,Fixed: $200.00,,https://www.upwork.com/jobs/~022044885630856574953,Australia
90,Remote AI Agent Developer,Seeking a skilled developer to create a smart personal business operator using OpenClaw. The system should manage and optimize business processes efficiently.,Hourly: $15.00-$30.00,,https://www.upwork.com/jobs/~022053235804989761970,Saudi Arabia
91,AI Agent Development for Business,"Seeking a skilled freelancer to develop an AI agent for business capable of performing tasks such as data analysis, customer service, and process automation. Budget: $10 fixed price.",Fixed: $10.00,,https://www.upwork.com/jobs/~022049160710388316762,United Kingdom
92,After hours voice ai agent,"Looking for an experienced voice AI developer to build an after-hours inbound agent for a UK-based healthcare clinic. Agent handles calls outside business hours. Uses Retell AI, ElevenLabs, Twilio, OpenAI/GPT, n8n, Cliniko API, and GoHighLevel. Handles new patient flows, existing patient lookup, rescheduling, cancellations.","Fixed: $1,700.00",,https://www.upwork.com/jobs/~022050074197629207932,Australia
93,LLM Agent Expert (AI Systems & Automation),"Building a next-generation AI-driven platform seeking an LLM Agent Expert to design, build, validate, and ship autonomous agent systems end-to-end. Responsibilities include multi-agent LLM systems, automated pipelines for content generation, agent-based QA systems, and observability frameworks.",Hourly: $3.00-$999.00,Describe your recent experience with similar projects,https://www.upwork.com/jobs/~022048438739295926874,Canada
94,Agentic AI developer,"Looking for an experienced Agentic AI developer to build an intelligent system that can autonomously interact across platforms like Discord and other social media channels. The AI agent should monitor, respond, and take actions across communities with minimal human intervention.",Hourly: $13.00-$30.00,,https://www.upwork.com/jobs/~022051512427448624083,USA
95,AI Customer Support Agent for E-Commerce,"Looking for an AI customer support assistant to handle a large portion of incoming support workload across website chat, email, and WhatsApp. Receives thousands of customer queries related to orders, shipping, refunds, product details. AI should integrate with order system, customer records, and FAQ knowledge base.",Fixed: $150.00,,https://www.upwork.com/jobs/~022046373073431669400,United States
96,AI Agent Developer for Real Estate,"Commercial real estate business looking to hire an experienced AI developer to design and implement Claude-powered agents. Will build: Lead generation agent (identify/qualify prospective tenants, buyers, investors) and Social media marketing agent (draft/schedule property listings, market insights). Budget $1,000-$5,000.",Hourly: $19.00-$40.00,"How would you design a lead generation agent that qualifies CRE prospects based on criteria like property type interest, budget, and timeline — and what tools would it need access to?",https://www.upwork.com/jobs/~022039056371840442267,United States
97,AI Voice Agent Automation,Home Services company looking to deploy a high-performance AI Voice Agent to handle inbound leads and outbound follow-ups using Retail AI (2026 Edition) and GoHighLevel CRM. Every call interaction including complex objections and scheduling should be captured and synchronized within CRM.,Fixed: $450.00,,https://www.upwork.com/jobs/~022049206798435546887,United States
98,AI Engineering Consultant,"BRYCER needs a consultant to design and build an internal AI agent that reviews incoming reports for completeness, validates required data fields, and confirms correct classification. Target: 4-week prototype scaling to processing 180,000 reports per month at 98% accuracy within six months.",Hourly: $19.00-$40.00,,https://www.upwork.com/jobs/~022052502069386318478,USA
99,Enterprise agent development,"Client will communicate what needs to be developed in detail. Looking for an agent developer with experience in app development, web development, Python, AI/ML, n8n, AI agent development.",Not listed,,https://www.upwork.com/jobs/~022048967516940728071,United States
100,AI Agent Developer,"LinkinLegal (legal tech company) looking for an AI Agent, MCP, and LLM Agent Developer responsible for designing, building, integrating, and deploying intelligent AI-powered agents for legal research, contract drafting, document review, compliance checking, due diligence, and workflow automation.",Not listed,,https://www.upwork.com/jobs/~022045970382382063694,United Arab Emirates
101,After hours voice ai agent,"Build an after-hours inbound AI voice agent for a UK-based healthcare clinic using Retell AI, ElevenLabs, Twilio, OpenAI/GPT, n8n, Cliniko API, and GoHighLevel. Handles new and existing patient flows including appointment scheduling, rescheduling, and cancellations.","$1,700.00 Fixed-price",,https://www.upwork.com/jobs/After-hours-voice-span-class-highlight-span-span-class-highlight-agent-span_~022050074197629207932/,AUS (Sunshine Coast)
102,AI Voice Agent for Real Estate Appointments,Seeking a skilled freelancer to develop an AI voice agent for booking real estate appointments. The project involves creating a voice assistant that can interact with clients to schedule viewings and manage bookings efficiently.,$19.00 - $20.00/hr,,https://www.upwork.com/jobs/span-class-highlight-span-Voice-span-class-highlight-Agent-span-for-Real-Estate-Appointments_~022045179099300388942/,Nigeria (Akure)
103,Senior AI Agent / Workflow Engineer,"A stealth-stage startup is looking for an experienced engineer to build a stateful, agentic workflow on top of modern LLM frameworks and to deliver a polished demo experience end-to-end. Involves multi-step AI workflows, Supervisor/Orchestrator implementation, and integration with collaboration platforms.",$70.00 - $85.00/hr,,https://www.upwork.com/jobs/Senior-span-class-highlight-span-span-class-highlight-Agent-span-Workflow-Engineer_~022041949896703591685/,United States (South Windsor)
104,Outbound Prospector AI Lead Generation Agent Development,Seeking an experienced developer to build three Outbound Prospector AI lead generating agents with strong background in AI development and lead generation techniques.,Not listed,Describe your recent experience with similar projects; Please list any certifications related to this project,https://www.upwork.com/jobs/Outbound-Prospector-span-class-highlight-span-Lead-Generation-span-class-highlight-Agent-span-Development_~022051812399679666284/,USA (Los Angeles)
105,Agentic AI Chatbot Developer (OpenAI / Supabase),Building an AI-driven platform called ProfitOS for entrepreneurs and creators. The chatbot will act like an AI business partner/CEO with an agentic system architecture (Think → Decide → Act → Respond loop) using OpenAI/Anthropic tool calling.,$150.00 Fixed-price,,https://www.upwork.com/jobs/span-class-highlight-Agentic-span-span-class-highlight-span-Chatbot-Developer-Open-span-class-highlight-span-Supabase_~022044518483306766537/,Turkey (Ataşehir / İstanbul)
106,AI Agent Developer,"Looking for an AI Agent, MCP & LLM Agent Developer for LinkinLegal to design, build, integrate and deploy intelligent AI-powered agents for legal research, contract drafting, document review, compliance checking, and workflow automation.",Not listed,,https://www.upwork.com/jobs/span-class-highlight-span-span-class-highlight-Agent-span-Developer_~022045970382382063694/,United Arab Emirates
107,Full-Time CLAUDE Code Expert for AI Agents,"Seeking a full-time CLAUDE Code expert to develop AI agents using n8n and other applications. Responsibilities include designing, implementing, and optimizing AI agent systems to enhance business processes.",Not listed,Describe your recent experience with similar projects,https://www.upwork.com/jobs/Full-Time-CLAUDE-Code-Expert-for-span-class-highlight-span-span-class-highlight-Agents-span_~022050435949309248711/,United States (Beverly Hills)
108,AI Engineer: Agent for Scientific Literature Analysis (Academic Research),"Yale University research group seeking an AI engineer to develop an agent-based system for large-scale scientific literature analysis. System should automatically retrieve, organize, and enable querying of research articles.",Not listed,,https://www.upwork.com/jobs/span-class-highlight-span-Engineer-span-class-highlight-Agent-span-for-Scientific-Literature-Analysis-Academic-Research_~022051084418774197204/,United States
109,AI Leasing Assistant Development,"Real estate property manager looking to build an automated AI leasing system that handles inbound leads from Zillow.com/Realtor.com, responds via email and SMS, and answers phone calls using an AI voice agent.",$100.00 Fixed-price,,https://www.upwork.com/jobs/span-class-highlight-span-Leasing-Assistant-Development_~022042828096278287657/,United States (College Station)
110,AI Agent Integration for Real Estate,Looking for someone who has an AI agent for real estate agents/companies already created and is willing to merge it into the client's business. Project involves integrating AI solutions into existing systems.,$100.00 Fixed-price,"Do you already have an agent created that you can present to me?; Can your agent help with social media posting, email management, calendar management?",https://www.upwork.com/jobs/span-class-highlight-span-span-class-highlight-Agent-span-Integration-for-Real-Estate_~022051035733317458792/,United States (Oak Park)
111,Looking for an Expert AI Agent Architect — Full Autonomous Business System openclaw/hermes ai,"Building a fully autonomous AI-powered business operating system with self-spawning departments, company-level agents, department-level agents, content creation automation, skill management system, mission control board, and security guardrails.",$500.00 Fixed-price,,https://www.upwork.com/jobs/Looking-for-Expert-span-class-highlight-span-span-class-highlight-Agent-span-Architect-Full-Autonomous-Business-System-openclaw-hermes-span-class-highlight-span_~022046023466239969705/,Norway (Oslo)
112,AI Agent Development for Outbound Booking Confirmations,"Seeking an experienced developer to create AI-driven digital, text, and voice agents that will streamline outbound booking confirmation processes including natural language processing and integration with existing booking systems.",$200.00 Fixed-price,,https://www.upwork.com/jobs/span-class-highlight-span-span-class-highlight-Agent-span-Development-for-Outbound-Booking-Confirmations_~022050024548124138344/,USA (Miami)
113,Build Fin AI Style AI Customer Service Agent,"Build an AI agent similar to Intercom's Fin AI using Vapi Cloud + n8n Cloud + Chatwoot Cloud stack. Natural conversation, real-time order lookup, multi-step procedures, 65-80% autonomous resolution target, and integration with ClickBank, Shopify, and Sticky.io.","$2,500.00 Fixed-price",,https://www.upwork.com/jobs/Build-Fin-span-class-highlight-span-Style-span-class-highlight-span-Customer-Service-span-class-highlight-Agent-span_~022043062023215675467/,United States (Norfolk)
114,AI Agent Developer for Real Estate,Commercial real estate business looking for an experienced AI developer to build Claude-powered agents: a lead generation agent and a social media marketing agent. Requires Anthropic Claude API experience and agentic workflows.,$19.00 - $40.00/hr,"How would you design a lead generation agent that qualifies CRE prospects based on criteria like property type interest, budget, and timeline — and what tools would it need access to?",https://www.upwork.com/jobs/span-class-highlight-span-span-class-highlight-Agent-span-Developer-for-Real-Estate_~022039056371840442267/,United States (Aventura)
115,"AI Agent Developer (LLMs, Automation, Multi-Agent Systems)","Seeking a talented AI Agent Developer to build intelligent, autonomous systems powered by large language models using Python and frameworks like LangChain, AutoGen, or CrewAI to develop scalable AI agents for automating complex workflows.",$19.00 - $40.00/hr,,https://www.upwork.com/jobs/span-class-highlight-span-span-class-highlight-Agent-span-Developer-LLMs-Automation-Multi-span-class-highlight-Agent-span-Systems_~022049620654537867968/,United States (California)
116,Artificial Intelligence Specialist for Real Estate & Manufacturing Innovation,"Seeking a highly motivated AI Specialist to lead the development and execution of an AI roadmap across real estate and manufacturing operations, identifying opportunities for automation, operational efficiency, lead generation, customer service enhancement, and AI-driven decision making.",$5.00 - $10.00/hr,,https://www.upwork.com/jobs/span-class-highlight-Artificial-span-span-class-highlight-Intelligence-span-Specialist-for-Real-Estate-amp-Manufacturing-Innovation_~022052383924012355169/,United States (Jamison)
117,Agentic AI developer,Looking for an experienced Agentic AI developer to build an intelligent system that can autonomously interact across platforms like Discord and other social media channels with multi-step reasoning and autonomous actions.,$13.00 - $30.00/hr,,https://www.upwork.com/jobs/span-class-highlight-Agentic-span-span-class-highlight-span-developer_~022051512427448624083/,USA (Frisco)
118,AI agent to scan the web for prices,Help build an AI Agent to search the web and scrape data from competitor websites to get prices of specific products. Bot to continually scrape for specific product names and check competitor prices and product updates.,$20.00 - $30.00/hr,,https://www.upwork.com/jobs/span-class-highlight-span-span-class-highlight-agent-span-scan-the-web-for-prices_~022050554193215014087/,Denmark
119,Customized Retell AI Agent,Looking for someone to build an AI Agent for an Advertising Agency using Retell and GoHighLevel CRM. Client has already cloned their voice using ElevenLabs with landing pages on Hostinger.,Not listed,,https://www.upwork.com/jobs/Customized-Retell-span-class-highlight-span-span-class-highlight-Agent-span_~022046236405157317585/,United States
120,Ai Booking Agent,"Seeking a skilled AI Engineer to design, develop, and deploy an intelligent AI Booking Agent. Multi-phase project: AI Foundation & Knowledge Setup, System Integration & Workflow Development, Advanced AI Capabilities (multilingual, voice, payment), Multi-Channel Expansion, and Optimization.",$15.00 - $23.00/hr,Describe your recent experience with similar projects,https://www.upwork.com/jobs/span-class-highlight-span-Booking-span-class-highlight-Agent-span_~022044699393610446429/,Malta
121,AI SMS Agent Trainer (Prompt Optimization),"Run cold SMS outreach campaigns for e-commerce store owners using an AI agent to handle conversations and book appointments. Need to sharpen the AI agent's performance by studying successful conversations, analyzing weaknesses, and rewriting/testing prompts.",$20.00 Fixed-price,,https://www.upwork.com/jobs/span-class-highlight-span-SMS-span-class-highlight-Agent-span-Trainer-Prompt-Optimization_~022052850890737928463/,Hong Kong (Kwun Tong)
122,AI Agent Developer Needed,"Seeking a skilled AI Agent Developer to create and implement intelligent agents for a cutting-edge project. Will work closely with the team to design, integrate, and optimize AI functionalities.",$50.00 Fixed-price,,https://www.upwork.com/jobs/span-class-highlight-span-span-class-highlight-Agent-span-Developer-Needed_~022052037325434643411/,United States Virgin Islands (Charlotte Amalie)
123,"Ai receptionist, Ai agent developer",Need someone to implement an AI receptionist into partner companies by changing the agent script and implementing the agent into other companies' systems.,Not listed,,https://www.upwork.com/jobs/span-class-highlight-span-receptionist-span-class-highlight-span-span-class-highlight-agent-span-developer_~022023118253431364444/,United States
124,AI Agent Trainer / Maintainer,"Ongoing role (10-15 hrs/week) to review AI agent conversations, identify where they fall short, update prompts and training data to close gaps, and flag patterns back to the team. Not an engineering role - focus on making agents smarter through improved prompts and knowledge.",Not listed,,https://www.upwork.com/jobs/span-class-highlight-span-span-class-highlight-Agent-span-Trainer-Maintainer_~022045096165419398866/,United Kingdom
125,AI Agent Chatbot Development with Voiceflow,"Seeking an experienced developer to create an AI agent chatbot using Voiceflow. Will design and implement a conversational interface that effectively engages users. Includes prototyping, testing, and refining the chatbot.",$50.00 Fixed-price,,https://www.upwork.com/jobs/span-class-highlight-span-span-class-highlight-Agent-span-Chatbot-Development-with-Voiceflow_~022042651931921194986/,United States (Cheyenne)
