#,Title,Summary,Price,Proposal Questions,Job URL,Client Location
224,AI masterplan project,"VANEL.TECH – Industrial AI Masterplan (Phase 1) to build Europe's most advanced AI-powered industrial commerce platform, surpassing McMaster-Carr, RS Components, and Grainger in UX, intelligence, and speed. Scope includes AI Orchestrator, Category Intelligence Framework, Magento integration, ranking engine, and frontend UX.","$5,000.00 Fixed-price",,https://www.upwork.com/jobs/span-class-highlight-span-masterplan-project_~022037920983793799408/,France
225,Consulting on AI Agent Architecture,"Looking for consulting on building AI Agent / Agentic AI for a product-ready application. Requires 1-hour consulting engagement with detailed LLD and generic solution architecture including fine-tuning approach, agent development framework, memory management, workflow orchestration, guardrails, and observability.",$30.00 - $40.00 Hourly,,https://www.upwork.com/jobs/Consulting-span-class-highlight-span-span-class-highlight-Agent-span-Architecture_~022051313759414437063/,India
226,AI Agent,Need to make AI agents using Claude SDK and do API integrations with other tools for automation.,Not listed (Hourly),,https://www.upwork.com/jobs/span-class-highlight-span-span-class-highlight-Agent-span_~022048764345294462933/,India
227,AI Agent Engineer,"Latin America based only. Full-time dedicated role for Agent Development & Deployment using Python and modern agentic frameworks (Google ADK, LangChain, LlamaIndex, CrewAI, OpenAI SDK). Includes LLM Evaluation & Optimization, Prompt Engineering, and RAG.",$19.00 - $24.00 Hourly,,https://www.upwork.com/jobs/span-class-highlight-span-span-class-highlight-Agent-span-Engineer_~022042339562870902792/,Uruguay
228,Build Advanced AI Content Automation System (n8n + OpenAI + Notion),"Looking for an automation engineer to build a scalable AI-powered content pipeline using n8n for YouTube channels (cybersecurity + anime), handling research, idea generation, scripting, and optimization. Features include multi-agent workflow, content scoring, memory system, and Notion integration.",$10.00 - $36.00 Hourly,,https://www.upwork.com/jobs/Build-Advanced-span-class-highlight-span-Content-Automation-System-n8n-Open-span-class-highlight-span-Notion_~022050056981162826600/,United States
229,AI Voice Agent Development on Vapi AI,Seeking an experienced developer to create a voice agent using Vapi AI. The ideal candidate will have a strong background in AI voice technologies and a proven track record of developing interactive voice applications.,$10.00 - $15.00 Hourly,,https://www.upwork.com/jobs/span-class-highlight-span-Voice-span-class-highlight-Agent-span-Development-Vapi-span-class-highlight-span_~022046551216416082897/,Nigeria
230,Builders of AI Agents and related applications,"Building an autonomous platform for developers creating AI agents and AI-powered applications. Seeking experienced builders actively shipping LLM-based systems in real client environments for a 15-min intro call, platform access, and 45-min deep dive on real workflows.",Not listed (Hourly),,https://www.upwork.com/jobs/Builders-span-class-highlight-span-span-class-highlight-Agents-span-and-related-applications_~022041245012257368833/,United States
231,AI Agent Developer - Problem Solving & Data Processing,"Seeking an experienced AI Agent developer to build a solution that can autonomously solve problems, fetch data from multiple sources, and intelligently sort and organize the results. Needs reliability, efficiency, and scalability.",$10.00 Hourly,,https://www.upwork.com/jobs/span-class-highlight-span-span-class-highlight-Agent-span-Developer-Problem-Solving-amp-Data-Processing_~022050247509741699776/,United States
232,Agentic AI Engineer - optimize our media monitoring stack,"Running a media monitoring operation in the public policy space, monitoring ~600-800 keywords across ~600 media sources. Need an agentic AI engineer to optimize the existing stack (OpenClaw, Claude Sonnet, Exa, Tavily) — not build from scratch.",$15.00 - $35.00 Hourly,,https://www.upwork.com/jobs/span-class-highlight-Agentic-span-span-class-highlight-span-Engineer-optimize-our-media-monitoring-stack_~022052487111345989284/,Canada
233,AI stock market agent,"Looking for an expert to design and build an autonomous, agentic trading system. The system must go beyond traditional rules-based screening to include AI-driven market analysis, intelligent buy/sell action execution, hyper-parameter optimization, and comprehensive backtesting capabilities.",Not listed (Hourly),"Have you done similar work? Describe your recent project: framework, tools used, share demo and time to develop | Describe your recent experience with similar projects | What tools do you use for data mining and visualization?",https://www.upwork.com/jobs/span-class-highlight-span-stock-market-span-class-highlight-agent-span_~022044147280099164095/,Lebanon
234,AI Python Developer for Sales Automation,"Looking for an experienced AI Python developer to create an intelligent system that automates sales workflows, customer support, lead qualification, scheduling, and CRM updates. The solution should integrate advanced AI agents, API integrations, and voice features.",$50.00 Fixed-price,,https://www.upwork.com/jobs/span-class-highlight-span-Python-Developer-for-Sales-Automation_~022052454433831947873/,United States
235,Build Agentic AI Engine,"Explain how to use agentic AI for investment real estate analysis and apply model to attached four real estate case studies. Covers autonomous AI for data collection, market analysis, predictive analytics, investment screening, decision support, and automation of routine tasks.",$30.00 - $60.00 Hourly,,https://www.upwork.com/jobs/Build-span-class-highlight-Agentic-span-span-class-highlight-span-Engine_~021967616316028445794/,United States
236,AI Agent Automation Implementation for Business,"Seeking an experienced freelancer to help implement AI agent automation within business processes. Expertise will help streamline operations, improve efficiency, and enhance customer engagement. Please provide examples of previous projects related to AI automation.",$10.00 Fixed-price,,https://www.upwork.com/jobs/span-class-highlight-span-span-class-highlight-Agent-span-Automation-Implementation-for-Business_~022051557420882511047/,India
237,"Build AI Automation Agent with LangGraph, FastAPI & Multi-Step Workflow Orchestration","Looking to automate a core business workflow using an AI agent. Needs a production-ready AI automation agent that accepts plain English input, classifies intent, executes multi-step workflows, validates output against a schema, and escalates to human review when confidence is low.",$100.00 Fixed-price,,https://www.upwork.com/jobs/Build-span-class-highlight-span-Automation-span-class-highlight-Agent-span-with-LangGraph-FastAPI-amp-Multi-Step-Workflow-Orchestration_~022042292782330856248/,Qatar
238,Agentic AI,"Build a secure Python-based agentic AI system using LLMs like OpenAI, with modular agents and sub-agents to analyze videos and use AI to auto-edit footage based on templates turning into high-quality short reels. Integrate AI, video, and audio tools with strong security, cost control, and automated orchestration.",$100.00 Fixed-price,,https://www.upwork.com/jobs/span-class-highlight-Agentic-span-span-class-highlight-span_~022049904371640034259/,United States
239,AI Agent Development for Workflow Automation,"Looking for a highly practical AI Agent Engineer to design and implement autonomous agents that handle real operational work across multiple projects. Systems where agents process information, make structured decisions, generate outputs, interact with data sources, and operate with minimal human intervention.",$15.00 - $40.00 Hourly,"Describe a real AI agent or system you built (problem, structure, models, what worked/failed) | If you had to build tomorrow a system that takes meeting notes, generates a structured report, and stores it, explain how you would design it step by step | Describe a system where your agent interacted with external APIs or data sources | Provide a GitHub link to a small working example you built | Show a real output produced by a system you built",https://www.upwork.com/jobs/span-class-highlight-span-span-class-highlight-Agent-span-Development-for-Workflow-Automation_~022047736478925025900/,Spain
240,OpenClaw Builder / AI Consultant to Productize Our Internal SOPs as AI Employees,"Apply with: (1) One production agent system you personally shipped with outcome, (2) The hardest bug you hit in agent memory or tool-use and how you fixed it, (3) One thing overrated and one thing underrated in agent design right now.",$35.00 - $100.00 Hourly,,https://www.upwork.com/jobs/OpenClaw-Builder-span-class-highlight-span-Consultant-Productize-Our-Internal-SOPs-span-class-highlight-span-Employees_~022050204981014949550/,UAE
241,Remote AI Architect & Orchestrator: RAG & Agentic Systems,ExeccuteAI is building the Vibe Coding Layer — an ecosystem where natural language intent is transformed into production-grade software. Looking for Architects (PhD/MSc) for RAG and multi-agent reasoning and VibeCoders (Expert Builders) for AI orchestration to build complex ERP/CRM/Blockchain integrations.,$40.00 - $70.00 Hourly,,https://www.upwork.com/jobs/Remote-span-class-highlight-span-Architect-amp-Orchestrator-RAG-amp-span-class-highlight-Agentic-span-Systems_~022046720538221666965/,Denmark
242,AI Automation & Agent Builder,"Looking for a hands-on builder to help create AI agents and automations for clients. This is a collaborative role working under and alongside the lead engineer. Will build and iterate on AI agents, work with Make/n8n, connect APIs, support LLM-based workflows, and debug existing automations.",$15.00 - $25.00 Hourly,What automations or agents have you built? (include tools used) | What experience do you have with AI agents or LLM workflows? | Are you comfortable working under an engineer in a collaborative setup?,https://www.upwork.com/jobs/span-class-highlight-span-Automation-amp-span-class-highlight-Agent-span-Builder_~022048455705412968405/,United States
243,Ai voice agent expert and app developer,"Seeking an AI Engineer to design and build a voice agent tailored for customer interactions. The role involves developing conversational AI workflows, integrating with business systems, and ensuring a seamless user experience. Also needs someone who can build an English speaking app.",Not listed (Hourly),,https://www.upwork.com/jobs/span-class-highlight-span-voice-span-class-highlight-agent-span-expert-and-app-developer_~022047707180051282073/,India
244,AI agent,"Looking for a skilled developer to help build AI agents that automate real business tasks. The goal is to create smart AI systems that understand instructions, make decisions, and complete workflows automatically using LLMs like OpenAI.",$10.00 - $14.00 Hourly,,https://www.upwork.com/jobs/span-class-highlight-span-span-class-highlight-agent-span_~022050129199532376768/,India
245,AI Agent & Machine Learning Project for Flight Trajectory and Go-Around Analysis,"Looking for support in the development of an AI-based aviation project focused on approach trajectories, go-around detection, and operational prediction tasks. Based on historical flight trajectories with variables such as position, altitude, speed, heading, and vertical rate.",Not listed (Hourly),,https://www.upwork.com/jobs/span-class-highlight-span-span-class-highlight-Agent-span-amp-Machine-Learning-Project-for-Flight-Trajectory-and-Around-Analysis_~022048368459266996377/,France
246,AI Voice Agent Builder (Vapi / Retell / n8n Automation),"Looking for someone who can build and connect AI voice agents using Vapi, Retell, and n8n to handle real conversations (customer support, lead qualification, follow-ups). Includes building inbound/outbound voice agents, connecting with n8n workflows, and integrating with APIs/CRMs.",$10.00 - $15.00 Hourly,,https://www.upwork.com/jobs/span-class-highlight-span-Voice-span-class-highlight-Agent-span-Builder-Vapi-Retell-n8n-Automation_~022046605250733765228/,Nigeria
247,Ai agents and automations,AI agency that helps businesses implement AI for their growth. Looking for a freelancer who is an expert in creating AI agents and automations for business owners in the UK.,Not listed (Hourly),,https://www.upwork.com/jobs/span-class-highlight-span-span-class-highlight-agents-span-and-automations_~022051314756552800965/,United Kingdom
248,OpenClaw Deployment & AI Agent Integration Specialist,"Need a professional to deliver a fully operational, configured OpenClaw setup including secure installation, initial agent configuration, basic personality setup, integration with a messaging app (Telegram/WhatsApp/Slack), access controls, security measures, backups, and documentation.",$50.00 - $100.00 Hourly,,https://www.upwork.com/jobs/OpenClaw-Deployment-amp-span-class-highlight-span-span-class-highlight-Agent-span-Integration-Specialist_~022052079830786544270/,Spain
249,AI Assistant top expert,"Looking for an experienced AI Agent developer to replicate the same AI Agent structure and functionality in a new website with a different subject. The AI agent talks and texts back, can switch between talking and text at any time. Also needs a small glitch fixed in the existing agent.",$145.00 Fixed-price,"Can you describe a similar AI agent project you have built or adapted before? | How would you approach replicating an existing AI agent structure into a new website with different content? | What technologies or frameworks do you usually use for AI agents, voice chat, and text chat? | How would you troubleshoot a small glitch where the agent switches between talking mode and text mode? | What will you need from me before starting and can you do this in less than 7 days?",https://www.upwork.com/jobs/span-class-highlight-span-Assistant-top-expert_~022047941907977468506/,Australia
250,"Senior AI Architect / Engineer – AI Agents, Agent Operators, Prompting & Private LLM (Long-Term)","Fast-growing car dealership looking to transform operations using AI. Seeking a highly experienced AI Architect to design and implement a complete AI-driven ecosystem including AI agents, agent operators, advanced prompting systems, and private LLM infrastructure.",$10.00 - $22.00 Hourly,Real AI System Experience - Describe a production-level AI system you personally built | Private/Self-Hosted LLM - Have you deployed a private or self-hosted LLM? | AI Architecture for Our Use Case - How would you design an AI system for a car dealership? | RAG & Internal Knowledge Systems - Explain how you would build a secure internal knowledge AI | Prompting & Cost Optimization - How do you design prompting systems that are both reliable and cost-efficient?,https://www.upwork.com/jobs/Senior-span-class-highlight-span-Architect-Engineer-span-class-highlight-span-span-class-highlight-Agents-span-span-class-highlight-Agent-span-Operators-Prompting-amp-Private-LLM-Long-Term_~022050582645491415749/,Canada
251,Founding AI Agent Developers – Early Builders for Central AI,"Central AI is building a platform where developers can create and publish AI agents that businesses can use for real-world tasks like customer support, lead qualification, appointment booking, and workflow automation. Goal is to help developers turn their AI projects into scalable products generating recurring income.",Not listed,None,https://www.upwork.com/jobs/Founding-span-class-highlight-span-span-class-highlight-Agent-span-Developers-Early-Builders-for-Central-span-class-highlight-span_~022048619075871928940/,India
252,N8N Ai Agent Buildout,"Build a multi-agent AI system to replace an Account Manager role for a printing company. System handles inbound intake, estimating, sales, closing, follow-up, and inbox management across voice, SMS, and email using n8n, HubSpot, Aircall, Twilio, Microsoft Outlook, MySQL, Pinecone, and Airtable.","$5,000.00 Fixed-price","Can you communicate in English? | Are you available to meet between 8am and 5pm for project updates on regular intervals? | Are you able to use MySql, powerBi and Hubspot connectors from N8N in order to pull real time contextual client history from transcripts, audio files and previous workorders for the ai agent to properly communicate with the customer?",https://www.upwork.com/jobs/N8N-span-class-highlight-span-span-class-highlight-Agent-span-Buildout_~021956465769606196166/,United States
253,Build an Intelligent Agentic AI System for Predictive Analytics (USA Real Estate),"Build an advanced Agentic AI System for USA real estate investment market to identify profitable patterns, predict investment opportunities, capture and qualify leads, automate research, and assist property investment agents. Multi-agent architecture with data collection, market analysis, lead qualification, and reporting agents.",$300.00 Fixed-price,None,https://www.upwork.com/jobs/Build-span-class-highlight-Intelligent-span-span-class-highlight-Agentic-span-span-class-highlight-span-System-for-Predictive-Analytics-USA-Real-Estate_~022050873915248788679/,Pakistan
254,AI Content Agent Developer,"Build a fully automated AI-powered social media system for a crypto/RWA token project. System should autonomously generate high-quality daily content, create branded images/GIFs/videos, route content for approval, and schedule/publish posts across X/Twitter, LinkedIn, Instagram, and Telegram.",$150.00 Fixed-price,None,https://www.upwork.com/jobs/span-class-highlight-span-Content-span-class-highlight-Agent-span-Developer_~022052189216734962643/,Sri Lanka
255,AI Automation Engineer / AI Agent Developer for Developing Automation System,"Design, develop, and deploy intelligent automation systems powered by AI agents and LLMs. Build scalable workflows using LangGraph, n8n, and similar tools, integrate LLMs, develop API-based automations across SaaS platforms and CRMs including GoHighLevel.",$10.00 Fixed-price,None,https://www.upwork.com/jobs/span-class-highlight-span-Automation-Engineer-span-class-highlight-span-span-class-highlight-Agent-span-Developer-for-Developing-Automation-System_~022043218009189435065/,Australia
256,AI Agent Engineer to Fix Infinite Reasoning Loop in Agent System,"Fix a critical issue in an agentic system where the AI agent gets stuck in an infinite reasoning loop. Agent is designed to plan tasks and call tools but repeatedly re-evaluates the same step without progressing. Causing high API costs, long response times, and failed task completion.",$50.00 Fixed-price,None,https://www.upwork.com/jobs/span-class-highlight-span-span-class-highlight-Agent-span-Engineer-Fix-Infinite-Reasoning-Loop-span-class-highlight-Agent-span-System_~022046978274129572460/,United Kingdom
257,"AI Developer Needed – WhatsApp or Voice AI Agent (Lead Capture, Automation)","Build a production-ready AI agent system that acts as a fully automated AI front desk and sales assistant, handling inbound WhatsApp and phone conversations. System should capture leads, qualify them, book appointments, run automated follow-ups, and escalate to humans when needed.",Not listed (Hourly),None,https://www.upwork.com/jobs/span-class-highlight-span-Developer-Needed-WhatsApp-Voice-span-class-highlight-span-span-class-highlight-Agent-span-Lead-Capture-Automation_~022052040280481656446/,Singapore
258,AI Agent Engineer (LangChain / LLM Systems) – Data Analytics Platform,"Build a production-grade AI agent system for data analytics and insights generation. Agents understand user queries in natural language, plan and execute analytical workflows, interact with data systems like CubeJS/ClickHouse, maintain conversational context and memory, and deliver production-ready outputs.",$15.00 - $75.00 Hourly,None,https://www.upwork.com/jobs/span-class-highlight-span-span-class-highlight-Agent-span-Engineer-LangChain-LLM-Systems-Data-Analytics-Platform_~022045426132749530834/,India
259,Retell AI Voice Agent Builder,"Build high-stakes AI voice agents in Retell for high-ticket medical businesses (ophthalmology and dental). Role involves implementing conversation flows from copywriter documents, writing prompts, structuring logic, configuring GoHighLevel, building follow-up sequences, and testing agents.",Not listed (Hourly),"Please share one Retell, VAPI, GoHighLevel, or similar build you are proud of. | What fixed fee would you propose for this project?",https://www.upwork.com/jobs/Retell-span-class-highlight-span-Voice-span-class-highlight-Agent-span-Builder_~022042750445443177125/,Norway
260,AW - AI Architect (Agent Orchestration & Systems),"Lead design of complex, non-deterministic systems focused on Stateful Multi-Agent Orchestrators. Design the Supervisor logic routing user intent to specialized sub-agents, define rigorous state schemas, architect strategy for replacing legacy systems with agentic architecture using LangGraph.",Not listed (Hourly),"We explicitly require production experience with LangGraph. Please describe a specific agent topology you designed and deployed. Did you use a cyclic graph, how did you handle the recursion limit? | In a long-running agent workflow, how do you handle Human-in-the-Loop pauses? If a user returns after 24 hours, how does your architecture rehydrate the state? | If two agents try to update the shared state simultaneously, how do you design the schema to prevent race conditions or data corruption?",https://www.upwork.com/jobs/span-class-highlight-span-Architect-span-class-highlight-Agent-span-Orchestration-amp-Systems_~022023321194977754614/,Thailand
261,AI/ML Engineer for Agent Development,"Develop and enhance AI agents for a platform. Role involves designing, training, and deploying AI models to improve agent performance and user interaction. Focus on machine learning and software development with an emphasis on AI agent technologies.",$19.00 - $40.00 Hourly,What techniques would you use to clean a data set? | Please list any certifications related to this project,https://www.upwork.com/jobs/span-class-highlight-span-Engineer-for-span-class-highlight-Agent-span-Development_~022044441184089474291/,Pakistan
262,n8n Developer / AI Builder,"Build a Multi-Agent AI Marketing System with 6 agents (Strategy, Project Manager, Content, SEO, Social, Analytics) using n8n, Claude API, WordPress REST API, LinkedIn/Facebook/Instagram API, GA4, Brevo, Notion, and Airtable. Phase 1 focuses on n8n workflows with Slack approval routing.",$25.00 - $47.00 Hourly,None,https://www.upwork.com/jobs/n8n-Developer-span-class-highlight-span-Builder_~022052115586833918386/,Germany
263,"Agentic AI, Data collection/organization, Workflow Optimization, Agents, Chatbots, good at Abacus.ai","AI Automation Expert for E-Commerce company to integrate AI across all business operations. Build integrated database from Outlook/OneNote/Amazon/eBay, searchable company knowledge base, brainstorming AI agent, customer service chatbot, inventory management automation. Requires Abacus.AI platform expertise.",$3.00 - $20.00 Hourly,None,https://www.upwork.com/jobs/span-class-highlight-Agentic-span-span-class-highlight-span-Data-collection-organization-Workflow-Optimization-span-class-highlight-Agents-span-Chatbots-good-Abacus-span-class-highlight-span_~022046414603877984920/,United States
264,AI Automation & AI Agent Builder Needed,"Skilled AI Automation & AI Agent Specialist to streamline operations, reduce manual work, and build intelligent systems. Design AI-powered automation workflows, build AI Agents interacting with different tools, integrate ChatGPT OpenAI API, connect platforms via Zapier/Make.com, automate lead generation and CRM updates.",$5.00 Fixed-price,None,https://www.upwork.com/jobs/span-class-highlight-span-Automation-amp-span-class-highlight-span-span-class-highlight-Agent-span-Builder-Needed_~022041366807795034942/,Nigeria
265,n8n Expert for AI Agent Development,"Develop an AI Agent for an Industrial Engineering university project. System generates documents and reports using RAG technology. Setup n8n workflow connecting to LLM, integrate vector database for RAG with PDF documents, configure document generation in PDF format and Google Sheets, setup Looker Studio dashboard and chat interface.",$150.00 Fixed-price,None,https://www.upwork.com/jobs/n8n-Expert-for-span-class-highlight-span-span-class-highlight-Agent-span-Development_~022048878055476371413/,Honduras
266,AI Agent Engineer to Fix Infinite Reasoning Loop in Agent System (2nd posting),"Fix critical issue in agentic system where AI agent gets stuck in infinite reasoning loop. Agent designed to plan tasks and call tools but repeatedly re-evaluates the same step. Causing high API costs, long response times, and failed task completion. Fix looping behavior in reasoning chain.",$50.00 Fixed-price,None,https://www.upwork.com/jobs/span-class-highlight-span-span-class-highlight-Agent-span-Engineer-Fix-Infinite-Reasoning-Loop-span-class-highlight-Agent-span-System_~022049882925956999938/,United Kingdom
267,"Agentic AI Design Patterns, RAG Framework,etc","Need help with queries about a Python program using Agentic AI, covering: RAG Framework and Issues, Multi Agent Implementation, and Design Patterns issues in Agentic AI.",$12.00 Fixed-price,None,https://www.upwork.com/jobs/span-class-highlight-Agentic-span-span-class-highlight-span-Design-Patterns-RAG-Framework-etc_~022035050478424894026/,India
